{
  "schema_version": "w3-restriction/0.1-draft",
  "source_id": "demo-source",
  "after_revision": 1,
  "high_watermark": 3,
  "retention_start": "2026-09-12T00:00:00Z",
  "events": [
    {
      "schema_version": "w3-restriction/0.1-draft",
      "event_type": "source.restriction.changed",
      "event_id": "demo-event-2",
      "aggregate_id": "demo-source",
      "aggregate_revision": 2,
      "occurred_at": "2026-09-13T00:00:00Z",
      "published_at": "2026-09-13T00:00:01Z",
      "payload": {
        "source_id": "demo-source",
        "restriction_id": "demo-restriction",
        "status": "RESTRICTED",
        "accuracy": "UNKNOWN",
        "reason_code": "POLICY_REVIEW",
        "replacement_source_id": null,
        "index_key": {
          "source_version_id": "demo-version",
          "extraction_revision_id": "demo-extraction",
          "representation": "text",
          "normalization_version": "demo-normalization"
        }
      }
    },
    {
      "schema_version": "w3-restriction/0.1-draft",
      "event_type": "source.restriction.changed",
      "event_id": "demo-event-3",
      "aggregate_id": "demo-source",
      "aggregate_revision": 3,
      "occurred_at": "2026-09-13T00:00:00Z",
      "published_at": "2026-09-13T00:00:01Z",
      "payload": {
        "source_id": "demo-source",
        "restriction_id": "demo-restriction",
        "status": "RELEASED",
        "accuracy": "UNKNOWN",
        "reason_code": "POLICY_REVIEW",
        "replacement_source_id": null,
        "index_key": {
          "source_version_id": "demo-version",
          "extraction_revision_id": "demo-extraction",
          "representation": "text",
          "normalization_version": "demo-normalization"
        }
      }
    }
  ]
}
